{
  "schemaVersion": 1,
  "triggerChance": 0.25,
  "dc": 13,
  "difficulties": [
    {
      "id": "normal",
      "displayName": "普通",
      "dcOffset": -2,
      "weight": 25,
      "rewardMultiplier": 1,
      "merchantCoins": 0
    },
    {
      "id": "advanced",
      "displayName": "进阶",
      "dcOffset": 0,
      "weight": 50,
      "rewardMultiplier": 1,
      "merchantCoins": 0
    },
    {
      "id": "hard",
      "displayName": "高难",
      "dcOffset": 2,
      "weight": 25,
      "rewardMultiplier": 2,
      "merchantCoins": 120
    }
  ],
  "failureHealthRatio": 0.2,
  "healAmount": 160,
  "energyRatio": 0.35,
  "terrorReduction": 30,
  "supplyFallbackCoins": 60,
  "boost": {
    "battles": 3,
    "damageRatio": 0.15,
    "reductionRatio": 0.1
  },
  "items": [
    {
      "id": "healing",
      "weight": 20,
      "physical": {
        "title": "实·石缝药泉",
        "description": "药草根系间渗出清泉，泉眼被碎石堵住。搬开石块、滤净泥沙，便能用泉水清洗伤口；松动的岩片锋利如刃。"
      },
      "ghost": {
        "title": "幽·井中魂露",
        "description": "井上悬着亡魂泪化的幽蓝露珠。念出井沿的旧名，安抚徘徊的魂魄，便能取露疗伤；惊扰它，阴寒便会侵入身体。"
      }
    },
    {
      "id": "boost",
      "weight": 20,
      "physical": {
        "title": "实·封存军械",
        "description": "守军留下的铁箱里封着刀油与甲片。撬开锈锁，修整刀刃和护甲，可撑过接下来的三场战斗；箱盖后的弹簧仍绷得很紧。"
      },
      "ghost": {
        "title": "幽·守墓灵誓",
        "description": "残旗前浮出阵亡守军的魂影。回应他们未竟的誓言，便能借得三战护佑；誓词若有差错，魂兵会将你们视为闯墓之敌。"
      }
    },
    {
      "id": "energy",
      "weight": 15,
      "physical": {
        "title": "实·守军烈酿",
        "description": "石龛里藏着守军御寒用的烈酿。辨出未变质的酒液，分给队员驱寒提神，重整战意；误饮坏酒则会灼伤脏腑。"
      },
      "ghost": {
        "title": "幽·聚魂灯阵",
        "description": "无人添油的幽灯围着魂火转动。疏通灯阵，让散逸灵力归入队伍；若碰断魂线，逆流便会穿身而过。"
      }
    },
    {
      "id": "calm",
      "weight": 10,
      "physical": {
        "title": "实·暗道风口",
        "description": "墓道积着令人眩晕的浊气，墙缝后隐有凉风。清开堵塞的通风石栅，让队员恢复清醒；腐朽石栅可能突然崩落。"
      },
      "ghost": {
        "title": "幽·引魂残经",
        "description": "墙后的亡魂反复诵念一段残经，低语正侵入队员心神。接上遗失的经句，送它们离去；念错则会引来更深的怨恨。"
      }
    },
    {
      "id": "supplies",
      "weight": 10,
      "physical": {
        "title": "实·绊索行囊",
        "description": "一只旧行囊挂在绷紧的机关线上，药包与干粮尚未腐坏。卸去绊索便能取出补给；失手会触动藏在墙内的短弩。"
      },
      "ghost": {
        "title": "幽·亡者遗赠",
        "description": "游魂守着生前未送出的行装，指尖穿过了包袱。替它辨认信上的归乡路，它便愿意留下补给；否认它的归处，会招来怨魂扑身。"
      }
    }
  ]
}
